{
  "contributor": "",
  "description": "",
  "md5": "c36837424f0f2dd31aa259dc683d307a",
  "version": 1,
  "published": true,
  "associated_files": [],
  "features": [],
  "notes": "",
  "license": "",
  "rel_filepath": "./mp4-live-LastTime-depRep-R1-0002.mp4",
  "mdms_number": "",
  "conforms_to": []
}
