{
  "contributor": "Telecom Paris / CANON Research Centre France",
  "description": "Static mapping in sample group description box",
  "mdms_number": "m64279",
  "rel_filepath": "./sample_group_static_mapping.mp4",
  "associated_files": [],
  "version": 1,
  "md5": "534552507ffc6aceb4b3dff1a92f5b46",
  "published": false,
  "features": [],
  "conforms_to": [],
  "notes": "",
  "license": ""
}
