{
  "contributor": "",
  "description": "",
  "md5": "fdda90def0b51a11e3dc3be55351057c",
  "version": 1,
  "published": true,
  "associated_files": [],
  "features": [],
  "notes": "",
  "license": "",
  "rel_filepath": "./mp4-live-LastTime-depRep-R3-0003.mp4",
  "mdms_number": "",
  "conforms_to": []
}
