{
  "contributor": "Telecom ParisTech",
  "description": "L-HEVC Conformance (spatial and multiview layered)",
  "md5": "0a2c82a6850969b44c7529e954e673a1",
  "version": 1,
  "published": true,
  "associated_files": [],
  "features": [
    "video track",
    "Extractors",
    "Implicit Reconstruction",
    "oinf, linf and oref track reference"
  ],
  "notes": "",
  "license": "",
  "rel_filepath": "./shvc_hev1_single_track.mp4",
  "mdms_number": "",
  "conforms_to": []
}
