{
  "contributor": "",
  "description": "",
  "md5": "e209b5c5db610d5969524a692a5e90c4",
  "version": 1,
  "published": true,
  "associated_files": [],
  "features": [],
  "notes": "",
  "license": "",
  "rel_filepath": "./mp4-live-LastTime-depRep-R1-0001.mp4",
  "mdms_number": "",
  "conforms_to": []
}
