{
  "contributor": "Telecom Paris",
  "description": "",
  "mdms_number": "m56755",
  "license": "",
  "md5": "3147cb35e30dc800bed569205b777f10",
  "rel_filepath": "./image_cens_128iv.heic",
  "version": 1,
  "published": false,
  "associated_files": [],
  "features": [],
  "notes": "",
  "conforms_to": []
}
