{
  "contributor": "CANON Research Centre France",
  "description": "Ellipse region with 'udes' annotation.",
  "mdms_number": "m63203",
  "rel_filepath": "./region-ellipse.heic",
  "associated_files": [],
  "version": 1,
  "md5": "f52ecc1163fcac8a54e19b4ca706dd7d",
  "published": false,
  "features": [],
  "conforms_to": [],
  "notes": "",
  "license": ""
}
