{
  "contributor": "Telecom ParisTech",
  "description": "L-HEVC Conformance (spatial and multiview layered)",
  "md5": "9cfe4a75265397c70dd378f63faa7567",
  "version": 1,
  "published": true,
  "associated_files": [],
  "features": ["video track", "Extractors", "Implicit Reconstruction"],
  "notes": "",
  "license": "",
  "rel_filepath": "./shvc_hev1_lhe1_multiple_tracks_implicit.mp4",
  "mdms_number": "",
  "conforms_to": []
}
