{
  "contributor": "Telecom Paris",
  "description": "",
  "mdms_number": "m56755",
  "license": "",
  "md5": "997dc996e49db3545f20e3ee618c3960",
  "rel_filepath": "./image_cenc_128iv.heic",
  "version": 1,
  "published": false,
  "associated_files": [],
  "features": [],
  "notes": "",
  "conforms_to": []
}
