{
  "contributor": "Fraunhofer IIS",
  "description": "Simple A/V",
  "md5": "6138df9c5b0dd2c2c3cae3b7408beb5d",
  "version": 1,
  "published": true,
  "associated_files": [],
  "features": ["Interleaved data", "IOD box", "mp4a sample entry"],
  "notes": "",
  "license": "",
  "rel_filepath": "./f1.mp4",
  "mdms_number": "",
  "conforms_to": []
}
