{
  "contributor": "Nokia",
  "description": "A file with SingleStreamProperty associated with overlay derived image item",
  "mdms_number": "m62051",
  "rel_filepath": "./HEVC_1440x960_derived_image_SSTR.heic",
  "associated_files": [],
  "version": 1,
  "md5": "00ec4328b48e4d9033bbbcc795ed416d",
  "published": false,
  "features": [],
  "conforms_to": [],
  "notes": "",
  "license": ""
}
