{
  "contributor": "Telecom ParisTech",
  "description": "large",
  "md5": "39c2065af324c14b9752e5e000e0cd79",
  "version": 1,
  "published": true,
  "associated_files": [],
  "features": [
    "Ordinary box",
    "64-bit length",
    "FTYP box",
    "Free/skip",
    "Movie box",
    "normal' order (moov-mdat)",
    "track enabled bit",
    "video track",
    "64-bit chunks",
    "ctts offsets",
    "sync table",
    "Copyright box"
  ],
  "notes": {
    "compressed": true
  },
  "license": "",
  "rel_filepath": "./14_large.mp4.zip",
  "mdms_number": "",
  "conforms_to": []
}
