{
  "contributor": "",
  "description": "",
  "md5": "f43027e041131c498ea6998400ee3f42",
  "version": 1,
  "published": true,
  "associated_files": ["./FX-VY-9436R.3_qhd.vinput.merged.xml"],
  "features": [],
  "notes": "",
  "license": "",
  "rel_filepath": "./FX-VY-9436R.3_qhd.mp4",
  "mdms_number": "",
  "conforms_to": []
}
